
*** Running vivado
    with args -log digital_safe.vdi -applog -m64 -product Vivado -messageDb vivado.pb -mode batch -source digital_safe.tcl -notrace


****** Vivado v2018.3 (64-bit)
  **** SW Build 2405991 on Thu Dec  6 23:38:27 MST 2018
  **** IP Build 2404404 on Fri Dec  7 01:43:56 MST 2018
    ** Copyright 1986-2018 Xilinx, Inc. All Rights Reserved.

source digital_safe.tcl -notrace
Command: link_design -top digital_safe -part xc7z020clg400-1
Design is defaulting to srcset: sources_1
Design is defaulting to constrset: constrs_1
INFO: [Netlist 29-17] Analyzing 14 Unisim elements for replacement
INFO: [Netlist 29-28] Unisim Transformation completed in 0 CPU seconds
INFO: [Project 1-479] Netlist was created with Vivado 2018.3
INFO: [Device 21-403] Loading part xc7z020clg400-1
INFO: [Project 1-570] Preparing netlist for logic optimization
Parsing XDC File [D:/Xilinx/Vivado/2018.3/data/boards/board_files/PYNQ-Z2 v1.0.xdc]
Finished Parsing XDC File [D:/Xilinx/Vivado/2018.3/data/boards/board_files/PYNQ-Z2 v1.0.xdc]
Parsing XDC File [D:/Xilinx/Vivado/2018.3/data/boards/board_files/RPI_Addon.xdc]
Finished Parsing XDC File [D:/Xilinx/Vivado/2018.3/data/boards/board_files/RPI_Addon.xdc]
INFO: [Opt 31-138] Pushed 0 inverter(s) to 0 load pin(s).
Netlist sorting complete. Time (s): cpu = 00:00:00 ; elapsed = 00:00:00.001 . Memory (MB): peak = 661.094 ; gain = 0.000
INFO: [Project 1-111] Unisim Transformation Summary:
No Unisim elements were transformed.

7 Infos, 0 Warnings, 0 Critical Warnings and 0 Errors encountered.
link_design completed successfully
link_design: Time (s): cpu = 00:00:04 ; elapsed = 00:00:06 . Memory (MB): peak = 665.270 ; gain = 339.738
Command: opt_design
Attempting to get a license for feature 'Implementation' and/or device 'xc7z020'
INFO: [Common 17-349] Got license for feature 'Implementation' and/or device 'xc7z020'
Running DRC as a precondition to command opt_design

Starting DRC Task
INFO: [DRC 23-27] Running DRC with 2 threads
INFO: [Project 1-461] DRC finished with 0 Errors
INFO: [Project 1-462] Please refer to the DRC report (report_drc) for more information.

Time (s): cpu = 00:00:01 ; elapsed = 00:00:00.587 . Memory (MB): peak = 675.051 ; gain = 9.781

Starting Cache Timing Information Task
INFO: [Timing 38-35] Done setting XDC timing constraints.
Ending Cache Timing Information Task | Checksum: 1ccc7a168

Time (s): cpu = 00:00:05 ; elapsed = 00:00:08 . Memory (MB): peak = 1231.410 ; gain = 556.359

Starting Logic Optimization Task

Phase 1 Retarget
INFO: [Opt 31-138] Pushed 0 inverter(s) to 0 load pin(s).
INFO: [Opt 31-49] Retargeted 0 cell(s).
Phase 1 Retarget | Checksum: 1ccc7a168

Time (s): cpu = 00:00:00 ; elapsed = 00:00:00.018 . Memory (MB): peak = 1328.824 ; gain = 0.000
INFO: [Opt 31-389] Phase Retarget created 0 cells and removed 0 cells

Phase 2 Constant propagation
INFO: [Opt 31-138] Pushed 0 inverter(s) to 0 load pin(s).
Phase 2 Constant propagation | Checksum: 1ccc7a168

Time (s): cpu = 00:00:00 ; elapsed = 00:00:00.023 . Memory (MB): peak = 1328.824 ; gain = 0.000
INFO: [Opt 31-389] Phase Constant propagation created 0 cells and removed 0 cells

Phase 3 Sweep
Phase 3 Sweep | Checksum: 196a2dc47

Time (s): cpu = 00:00:00 ; elapsed = 00:00:00.030 . Memory (MB): peak = 1328.824 ; gain = 0.000
INFO: [Opt 31-389] Phase Sweep created 0 cells and removed 0 cells

Phase 4 BUFG optimization
Phase 4 BUFG optimization | Checksum: 196a2dc47

Time (s): cpu = 00:00:00 ; elapsed = 00:00:00.038 . Memory (MB): peak = 1328.824 ; gain = 0.000
INFO: [Opt 31-662] Phase BUFG optimization created 0 cells of which 0 are BUFGs and removed 0 cells.

Phase 5 Shift Register Optimization
Phase 5 Shift Register Optimization | Checksum: 1531b1e73

Time (s): cpu = 00:00:00 ; elapsed = 00:00:00.072 . Memory (MB): peak = 1328.824 ; gain = 0.000
INFO: [Opt 31-389] Phase Shift Register Optimization created 0 cells and removed 0 cells

Phase 6 Post Processing Netlist
Phase 6 Post Processing Netlist | Checksum: 1531b1e73

Time (s): cpu = 00:00:00 ; elapsed = 00:00:00.074 . Memory (MB): peak = 1328.824 ; gain = 0.000
INFO: [Opt 31-389] Phase Post Processing Netlist created 0 cells and removed 0 cells
Opt_design Change Summary
=========================


-------------------------------------------------------------------------------------------------------------------------
|  Phase                        |  #Cells created  |  #Cells Removed  |  #Constrained objects preventing optimizations  |
-------------------------------------------------------------------------------------------------------------------------
|  Retarget                     |               0  |               0  |                                              0  |
|  Constant propagation         |               0  |               0  |                                              0  |
|  Sweep                        |               0  |               0  |                                              0  |
|  BUFG optimization            |               0  |               0  |                                              0  |
|  Shift Register Optimization  |               0  |               0  |                                              0  |
|  Post Processing Netlist      |               0  |               0  |                                              0  |
-------------------------------------------------------------------------------------------------------------------------



Starting Connectivity Check Task

Time (s): cpu = 00:00:00 ; elapsed = 00:00:00.001 . Memory (MB): peak = 1328.824 ; gain = 0.000
Ending Logic Optimization Task | Checksum: 1531b1e73

Time (s): cpu = 00:00:00 ; elapsed = 00:00:00.077 . Memory (MB): peak = 1328.824 ; gain = 0.000

Starting Power Optimization Task
INFO: [Pwropt 34-132] Skipping clock gating for clocks with a period < 2.00 ns.
Ending Power Optimization Task | Checksum: 1531b1e73

Time (s): cpu = 00:00:00 ; elapsed = 00:00:00.009 . Memory (MB): peak = 1328.824 ; gain = 0.000

Starting Final Cleanup Task
Ending Final Cleanup Task | Checksum: 1531b1e73

Time (s): cpu = 00:00:00 ; elapsed = 00:00:00 . Memory (MB): peak = 1328.824 ; gain = 0.000

Starting Netlist Obfuscation Task
Netlist sorting complete. Time (s): cpu = 00:00:00 ; elapsed = 00:00:00.001 . Memory (MB): peak = 1328.824 ; gain = 0.000
Ending Netlist Obfuscation Task | Checksum: 1531b1e73

Time (s): cpu = 00:00:00 ; elapsed = 00:00:00.001 . Memory (MB): peak = 1328.824 ; gain = 0.000
INFO: [Common 17-83] Releasing license: Implementation
23 Infos, 0 Warnings, 0 Critical Warnings and 0 Errors encountered.
opt_design completed successfully
opt_design: Time (s): cpu = 00:00:07 ; elapsed = 00:00:10 . Memory (MB): peak = 1328.824 ; gain = 663.555
Netlist sorting complete. Time (s): cpu = 00:00:00 ; elapsed = 00:00:00 . Memory (MB): peak = 1328.824 ; gain = 0.000
INFO: [Timing 38-480] Writing timing data to binary archive.
Writing placer database...
Writing XDEF routing.
Writing XDEF routing logical nets.
Writing XDEF routing special nets.
Write XDEF Complete: Time (s): cpu = 00:00:00 ; elapsed = 00:00:00.052 . Memory (MB): peak = 1328.824 ; gain = 0.000
Netlist sorting complete. Time (s): cpu = 00:00:00 ; elapsed = 00:00:00 . Memory (MB): peak = 1328.824 ; gain = 0.000
INFO: [Common 17-1381] The checkpoint 'D:/Assignment/Codes/Digital Design/DD_final/DD_final.runs/impl_1/digital_safe_opt.dcp' has been generated.
INFO: [runtcl-4] Executing : report_drc -file digital_safe_drc_opted.rpt -pb digital_safe_drc_opted.pb -rpx digital_safe_drc_opted.rpx
Command: report_drc -file digital_safe_drc_opted.rpt -pb digital_safe_drc_opted.pb -rpx digital_safe_drc_opted.rpx
INFO: [IP_Flow 19-234] Refreshing IP repositories
INFO: [IP_Flow 19-1704] No user IP repositories specified
INFO: [IP_Flow 19-2313] Loaded Vivado IP repository 'D:/Xilinx/Vivado/2018.3/data/ip'.
INFO: [DRC 23-27] Running DRC with 2 threads
INFO: [Coretcl 2-168] The results of DRC are in file D:/Assignment/Codes/Digital Design/DD_final/DD_final.runs/impl_1/digital_safe_drc_opted.rpt.
report_drc completed successfully
Command: place_design
Attempting to get a license for feature 'Implementation' and/or device 'xc7z020'
INFO: [Common 17-349] Got license for feature 'Implementation' and/or device 'xc7z020'
INFO: [DRC 23-27] Running DRC with 2 threads
INFO: [Vivado_Tcl 4-198] DRC finished with 0 Errors
INFO: [Vivado_Tcl 4-199] Please refer to the DRC report (report_drc) for more information.
Running DRC as a precondition to command place_design
INFO: [DRC 23-27] Running DRC with 2 threads
INFO: [Vivado_Tcl 4-198] DRC finished with 0 Errors
INFO: [Vivado_Tcl 4-199] Please refer to the DRC report (report_drc) for more information.

Starting Placer Task
INFO: [Place 30-611] Multithreading enabled for place_design using a maximum of 2 CPUs

Phase 1 Placer Initialization

Phase 1.1 Placer Initialization Netlist Sorting
Netlist sorting complete. Time (s): cpu = 00:00:00 ; elapsed = 00:00:00 . Memory (MB): peak = 1328.824 ; gain = 0.000
Phase 1.1 Placer Initialization Netlist Sorting | Checksum: 11e84539f

Time (s): cpu = 00:00:00 ; elapsed = 00:00:00.004 . Memory (MB): peak = 1328.824 ; gain = 0.000
Netlist sorting complete. Time (s): cpu = 00:00:00 ; elapsed = 00:00:00.001 . Memory (MB): peak = 1328.824 ; gain = 0.000

Phase 1.2 IO Placement/ Clock Placement/ Build Placer Device
INFO: [Timing 38-35] Done setting XDC timing constraints.
Phase 1.2 IO Placement/ Clock Placement/ Build Placer Device | Checksum: 10c9fbc26

Time (s): cpu = 00:00:01 ; elapsed = 00:00:00.667 . Memory (MB): peak = 1339.754 ; gain = 10.930

Phase 1.3 Build Placer Netlist Model
Phase 1.3 Build Placer Netlist Model | Checksum: 1c19045ca

Time (s): cpu = 00:00:01 ; elapsed = 00:00:00.694 . Memory (MB): peak = 1339.754 ; gain = 10.930

Phase 1.4 Constrain Clocks/Macros
Phase 1.4 Constrain Clocks/Macros | Checksum: 1c19045ca

Time (s): cpu = 00:00:01 ; elapsed = 00:00:00.697 . Memory (MB): peak = 1339.754 ; gain = 10.930
Phase 1 Placer Initialization | Checksum: 1c19045ca

Time (s): cpu = 00:00:01 ; elapsed = 00:00:00.698 . Memory (MB): peak = 1339.754 ; gain = 10.930

Phase 2 Global Placement

Phase 2.1 Floorplanning
Phase 2.1 Floorplanning | Checksum: 1c19045ca

Time (s): cpu = 00:00:01 ; elapsed = 00:00:00.702 . Memory (MB): peak = 1340.652 ; gain = 11.828
WARNING: [Place 46-29] place_design is not in timing mode. Skip physical synthesis in placer
Phase 2 Global Placement | Checksum: 111814ca8

Time (s): cpu = 00:00:01 ; elapsed = 00:00:01 . Memory (MB): peak = 1345.875 ; gain = 17.051

Phase 3 Detail Placement

Phase 3.1 Commit Multi Column Macros
Phase 3.1 Commit Multi Column Macros | Checksum: 111814ca8

Time (s): cpu = 00:00:01 ; elapsed = 00:00:01 . Memory (MB): peak = 1345.875 ; gain = 17.051

Phase 3.2 Commit Most Macros & LUTRAMs
Phase 3.2 Commit Most Macros & LUTRAMs | Checksum: 18a40e5e5

Time (s): cpu = 00:00:01 ; elapsed = 00:00:01 . Memory (MB): peak = 1345.875 ; gain = 17.051

Phase 3.3 Area Swap Optimization
Phase 3.3 Area Swap Optimization | Checksum: bd9ac6b2

Time (s): cpu = 00:00:01 ; elapsed = 00:00:01 . Memory (MB): peak = 1345.875 ; gain = 17.051

Phase 3.4 Pipeline Register Optimization
Phase 3.4 Pipeline Register Optimization | Checksum: bd9ac6b2

Time (s): cpu = 00:00:01 ; elapsed = 00:00:01 . Memory (MB): peak = 1345.875 ; gain = 17.051

Phase 3.5 Small Shape Detail Placement
Phase 3.5 Small Shape Detail Placement | Checksum: 15ad1025d

Time (s): cpu = 00:00:01 ; elapsed = 00:00:01 . Memory (MB): peak = 1352.113 ; gain = 23.289

Phase 3.6 Re-assign LUT pins
Phase 3.6 Re-assign LUT pins | Checksum: 15ad1025d

Time (s): cpu = 00:00:01 ; elapsed = 00:00:01 . Memory (MB): peak = 1352.113 ; gain = 23.289

Phase 3.7 Pipeline Register Optimization
Phase 3.7 Pipeline Register Optimization | Checksum: 15ad1025d

Time (s): cpu = 00:00:01 ; elapsed = 00:00:01 . Memory (MB): peak = 1352.113 ; gain = 23.289
Phase 3 Detail Placement | Checksum: 15ad1025d

Time (s): cpu = 00:00:01 ; elapsed = 00:00:01 . Memory (MB): peak = 1352.113 ; gain = 23.289

Phase 4 Post Placement Optimization and Clean-Up

Phase 4.1 Post Commit Optimization
Phase 4.1 Post Commit Optimization | Checksum: 15ad1025d

Time (s): cpu = 00:00:01 ; elapsed = 00:00:01 . Memory (MB): peak = 1352.113 ; gain = 23.289

Phase 4.2 Post Placement Cleanup
Phase 4.2 Post Placement Cleanup | Checksum: 15ad1025d

Time (s): cpu = 00:00:01 ; elapsed = 00:00:01 . Memory (MB): peak = 1352.113 ; gain = 23.289

Phase 4.3 Placer Reporting
Phase 4.3 Placer Reporting | Checksum: 15ad1025d

Time (s): cpu = 00:00:01 ; elapsed = 00:00:01 . Memory (MB): peak = 1352.113 ; gain = 23.289

Phase 4.4 Final Placement Cleanup
Netlist sorting complete. Time (s): cpu = 00:00:00 ; elapsed = 00:00:00 . Memory (MB): peak = 1352.113 ; gain = 0.000
Phase 4.4 Final Placement Cleanup | Checksum: c3298452

Time (s): cpu = 00:00:01 ; elapsed = 00:00:01 . Memory (MB): peak = 1352.113 ; gain = 23.289
Phase 4 Post Placement Optimization and Clean-Up | Checksum: c3298452

Time (s): cpu = 00:00:01 ; elapsed = 00:00:01 . Memory (MB): peak = 1352.113 ; gain = 23.289
Ending Placer Task | Checksum: 572b8958

Time (s): cpu = 00:00:01 ; elapsed = 00:00:01 . Memory (MB): peak = 1352.113 ; gain = 23.289
INFO: [Common 17-83] Releasing license: Implementation
41 Infos, 1 Warnings, 0 Critical Warnings and 0 Errors encountered.
place_design completed successfully
Netlist sorting complete. Time (s): cpu = 00:00:00 ; elapsed = 00:00:00 . Memory (MB): peak = 1352.113 ; gain = 0.000
INFO: [Timing 38-480] Writing timing data to binary archive.
Writing placer database...
Writing XDEF routing.
Writing XDEF routing logical nets.
Writing XDEF routing special nets.
Write XDEF Complete: Time (s): cpu = 00:00:00 ; elapsed = 00:00:00.090 . Memory (MB): peak = 1358.043 ; gain = 5.930
Netlist sorting complete. Time (s): cpu = 00:00:00 ; elapsed = 00:00:00.001 . Memory (MB): peak = 1358.043 ; gain = 0.000
INFO: [Common 17-1381] The checkpoint 'D:/Assignment/Codes/Digital Design/DD_final/DD_final.runs/impl_1/digital_safe_placed.dcp' has been generated.
INFO: [runtcl-4] Executing : report_io -file digital_safe_io_placed.rpt
report_io: Time (s): cpu = 00:00:00 ; elapsed = 00:00:00.061 . Memory (MB): peak = 1358.047 ; gain = 0.000
INFO: [runtcl-4] Executing : report_utilization -file digital_safe_utilization_placed.rpt -pb digital_safe_utilization_placed.pb
INFO: [runtcl-4] Executing : report_control_sets -verbose -file digital_safe_control_sets_placed.rpt
report_control_sets: Time (s): cpu = 00:00:00 ; elapsed = 00:00:00.002 . Memory (MB): peak = 1358.047 ; gain = 0.000
Command: route_design
Attempting to get a license for feature 'Implementation' and/or device 'xc7z020'
INFO: [Common 17-349] Got license for feature 'Implementation' and/or device 'xc7z020'
Running DRC as a precondition to command route_design
INFO: [DRC 23-27] Running DRC with 2 threads
INFO: [Vivado_Tcl 4-198] DRC finished with 0 Errors
INFO: [Vivado_Tcl 4-199] Please refer to the DRC report (report_drc) for more information.


Starting Routing Task
INFO: [Route 35-254] Multithreading enabled for route_design using a maximum of 2 CPUs
Checksum: PlaceDB: 4ac25851 ConstDB: 0 ShapeSum: c693107 RouteDB: 0

Phase 1 Build RT Design
Phase 1 Build RT Design | Checksum: 17fa94a45

Time (s): cpu = 00:00:18 ; elapsed = 00:00:22 . Memory (MB): peak = 1493.090 ; gain = 135.043
Post Restoration Checksum: NetGraph: fc9b5f44 NumContArr: 830deb01 Constraints: 0 Timing: 0

Phase 2 Router Initialization
INFO: [Route 35-64] No timing constraints were detected. The router will operate in resource-optimization mode.

Phase 2.1 Fix Topology Constraints
Phase 2.1 Fix Topology Constraints | Checksum: 17fa94a45

Time (s): cpu = 00:00:18 ; elapsed = 00:00:22 . Memory (MB): peak = 1499.012 ; gain = 140.965

Phase 2.2 Pre Route Cleanup
Phase 2.2 Pre Route Cleanup | Checksum: 17fa94a45

Time (s): cpu = 00:00:18 ; elapsed = 00:00:22 . Memory (MB): peak = 1499.012 ; gain = 140.965
 Number of Nodes with overlaps = 0
Phase 2 Router Initialization | Checksum: 1a2682eb4

Time (s): cpu = 00:00:18 ; elapsed = 00:00:22 . Memory (MB): peak = 1511.617 ; gain = 153.570

Phase 3 Initial Routing
Phase 3 Initial Routing | Checksum: 2c7efd80

Time (s): cpu = 00:00:18 ; elapsed = 00:00:22 . Memory (MB): peak = 1511.617 ; gain = 153.570

Phase 4 Rip-up And Reroute

Phase 4.1 Global Iteration 0
 Number of Nodes with overlaps = 52
 Number of Nodes with overlaps = 0
Phase 4.1 Global Iteration 0 | Checksum: 1524d5bb0

Time (s): cpu = 00:00:18 ; elapsed = 00:00:22 . Memory (MB): peak = 1511.617 ; gain = 153.570
Phase 4 Rip-up And Reroute | Checksum: 1524d5bb0

Time (s): cpu = 00:00:18 ; elapsed = 00:00:22 . Memory (MB): peak = 1511.617 ; gain = 153.570

Phase 5 Delay and Skew Optimization
Phase 5 Delay and Skew Optimization | Checksum: 1524d5bb0

Time (s): cpu = 00:00:18 ; elapsed = 00:00:22 . Memory (MB): peak = 1511.617 ; gain = 153.570

Phase 6 Post Hold Fix

Phase 6.1 Hold Fix Iter
Phase 6.1 Hold Fix Iter | Checksum: 1524d5bb0

Time (s): cpu = 00:00:18 ; elapsed = 00:00:22 . Memory (MB): peak = 1511.617 ; gain = 153.570
Phase 6 Post Hold Fix | Checksum: 1524d5bb0

Time (s): cpu = 00:00:18 ; elapsed = 00:00:22 . Memory (MB): peak = 1511.617 ; gain = 153.570

Phase 7 Route finalize

Router Utilization Summary
  Global Vertical Routing Utilization    = 0.124107 %
  Global Horizontal Routing Utilization  = 0.113083 %
  Routable Net Status*
  *Does not include unroutable nets such as driverless and loadless.
  Run report_route_status for detailed report.
  Number of Failed Nets               = 0
  Number of Unrouted Nets             = 0
  Number of Partially Routed Nets     = 0
  Number of Node Overlaps             = 0

Congestion Report
North Dir 1x1 Area, Max Cong = 27.9279%, No Congested Regions.
South Dir 1x1 Area, Max Cong = 28.8288%, No Congested Regions.
East Dir 1x1 Area, Max Cong = 23.5294%, No Congested Regions.
West Dir 1x1 Area, Max Cong = 23.5294%, No Congested Regions.

------------------------------
Reporting congestion hotspots
------------------------------
Direction: North
----------------
Congested clusters found at Level 0
Effective congestion level: 0 Aspect Ratio: 1 Sparse Ratio: 0
Direction: South
----------------
Congested clusters found at Level 0
Effective congestion level: 0 Aspect Ratio: 1 Sparse Ratio: 0
Direction: East
----------------
Congested clusters found at Level 0
Effective congestion level: 0 Aspect Ratio: 1 Sparse Ratio: 0
Direction: West
----------------
Congested clusters found at Level 0
Effective congestion level: 0 Aspect Ratio: 1 Sparse Ratio: 0

Phase 7 Route finalize | Checksum: 1524d5bb0

Time (s): cpu = 00:00:18 ; elapsed = 00:00:22 . Memory (MB): peak = 1511.617 ; gain = 153.570

Phase 8 Verifying routed nets

 Verification completed successfully
Phase 8 Verifying routed nets | Checksum: 1524d5bb0

Time (s): cpu = 00:00:18 ; elapsed = 00:00:22 . Memory (MB): peak = 1512.898 ; gain = 154.852

Phase 9 Depositing Routes
Phase 9 Depositing Routes | Checksum: 1e902f410

Time (s): cpu = 00:00:18 ; elapsed = 00:00:22 . Memory (MB): peak = 1512.898 ; gain = 154.852
INFO: [Route 35-16] Router Completed Successfully

Time (s): cpu = 00:00:18 ; elapsed = 00:00:22 . Memory (MB): peak = 1512.898 ; gain = 154.852

Routing Is Done.
INFO: [Common 17-83] Releasing license: Implementation
54 Infos, 1 Warnings, 0 Critical Warnings and 0 Errors encountered.
route_design completed successfully
route_design: Time (s): cpu = 00:00:19 ; elapsed = 00:00:23 . Memory (MB): peak = 1512.898 ; gain = 154.852
Netlist sorting complete. Time (s): cpu = 00:00:00 ; elapsed = 00:00:00 . Memory (MB): peak = 1512.898 ; gain = 0.000
INFO: [Timing 38-480] Writing timing data to binary archive.
Writing placer database...
Writing XDEF routing.
Writing XDEF routing logical nets.
Writing XDEF routing special nets.
Write XDEF Complete: Time (s): cpu = 00:00:01 ; elapsed = 00:00:00.094 . Memory (MB): peak = 1512.898 ; gain = 0.000
Netlist sorting complete. Time (s): cpu = 00:00:00 ; elapsed = 00:00:00 . Memory (MB): peak = 1512.898 ; gain = 0.000
INFO: [Common 17-1381] The checkpoint 'D:/Assignment/Codes/Digital Design/DD_final/DD_final.runs/impl_1/digital_safe_routed.dcp' has been generated.
INFO: [runtcl-4] Executing : report_drc -file digital_safe_drc_routed.rpt -pb digital_safe_drc_routed.pb -rpx digital_safe_drc_routed.rpx
Command: report_drc -file digital_safe_drc_routed.rpt -pb digital_safe_drc_routed.pb -rpx digital_safe_drc_routed.rpx
INFO: [IP_Flow 19-1839] IP Catalog is up to date.
INFO: [DRC 23-27] Running DRC with 2 threads
INFO: [Coretcl 2-168] The results of DRC are in file D:/Assignment/Codes/Digital Design/DD_final/DD_final.runs/impl_1/digital_safe_drc_routed.rpt.
report_drc completed successfully
INFO: [runtcl-4] Executing : report_methodology -file digital_safe_methodology_drc_routed.rpt -pb digital_safe_methodology_drc_routed.pb -rpx digital_safe_methodology_drc_routed.rpx
Command: report_methodology -file digital_safe_methodology_drc_routed.rpt -pb digital_safe_methodology_drc_routed.pb -rpx digital_safe_methodology_drc_routed.rpx
INFO: [Timing 38-35] Done setting XDC timing constraints.
INFO: [DRC 23-133] Running Methodology with 2 threads
INFO: [Coretcl 2-1520] The results of Report Methodology are in file D:/Assignment/Codes/Digital Design/DD_final/DD_final.runs/impl_1/digital_safe_methodology_drc_routed.rpt.
report_methodology completed successfully
INFO: [runtcl-4] Executing : report_power -file digital_safe_power_routed.rpt -pb digital_safe_power_summary_routed.pb -rpx digital_safe_power_routed.rpx
Command: report_power -file digital_safe_power_routed.rpt -pb digital_safe_power_summary_routed.pb -rpx digital_safe_power_routed.rpx
WARNING: [Power 33-232] No user defined clocks were found in the design!
Resolution: Please specify clocks using create_clock/create_generated_clock for sequential elements. For pure combinatorial circuits, please specify a virtual clock, otherwise the vectorless estimation might be inaccurate
INFO: [Timing 38-35] Done setting XDC timing constraints.
Running Vector-less Activity Propagation...

Finished Running Vector-less Activity Propagation
66 Infos, 2 Warnings, 0 Critical Warnings and 0 Errors encountered.
report_power completed successfully
INFO: [runtcl-4] Executing : report_route_status -file digital_safe_route_status.rpt -pb digital_safe_route_status.pb
INFO: [runtcl-4] Executing : report_timing_summary -max_paths 10 -file digital_safe_timing_summary_routed.rpt -pb digital_safe_timing_summary_routed.pb -rpx digital_safe_timing_summary_routed.rpx -warn_on_violation 
INFO: [Timing 38-91] UpdateTimingParams: Speed grade: -1, Delay Type: min_max.
INFO: [Timing 38-191] Multithreading enabled for timing update using a maximum of 2 CPUs
WARNING: [Timing 38-313] There are no user specified timing constraints. Timing constraints are needed for proper timing analysis.
INFO: [runtcl-4] Executing : report_incremental_reuse -file digital_safe_incremental_reuse_routed.rpt
INFO: [Vivado_Tcl 4-1062] Incremental flow is disabled. No incremental reuse Info to report.
INFO: [runtcl-4] Executing : report_clock_utilization -file digital_safe_clock_utilization_routed.rpt
INFO: [runtcl-4] Executing : report_bus_skew -warn_on_violation -file digital_safe_bus_skew_routed.rpt -pb digital_safe_bus_skew_routed.pb -rpx digital_safe_bus_skew_routed.rpx
INFO: [Timing 38-91] UpdateTimingParams: Speed grade: -1, Delay Type: min_max.
INFO: [Timing 38-191] Multithreading enabled for timing update using a maximum of 2 CPUs
Command: write_bitstream -force digital_safe.bit
Attempting to get a license for feature 'Implementation' and/or device 'xc7z020'
INFO: [Common 17-349] Got license for feature 'Implementation' and/or device 'xc7z020'
Running DRC as a precondition to command write_bitstream
INFO: [IP_Flow 19-1839] IP Catalog is up to date.
INFO: [DRC 23-27] Running DRC with 2 threads
WARNING: [DRC ZPS7-1] PS7 block required: The PS7 cell must be used in this Zynq design in order to enable correct default configuration.
INFO: [Vivado 12-3199] DRC finished with 0 Errors, 1 Warnings
INFO: [Vivado 12-3200] Please refer to the DRC report (report_drc) for more information.
INFO: [Designutils 20-2272] Running write_bitstream with 2 threads.
Loading data files...
Loading site data...
Loading route data...
Processing options...
Creating bitmap...
Creating bitstream...
Writing bitstream ./digital_safe.bit...
INFO: [Vivado 12-1842] Bitgen Completed Successfully.
INFO: [Project 1-120] WebTalk data collection is mandatory when using a WebPACK part without a full Vivado license. To see the specific WebTalk data collected for your design, open the usage_statistics_webtalk.html or usage_statistics_webtalk.xml file in the implementation directory.
Access is denied.
Access is denied.
INFO: [Common 17-83] Releasing license: Implementation
85 Infos, 4 Warnings, 0 Critical Warnings and 0 Errors encountered.
write_bitstream completed successfully
write_bitstream: Time (s): cpu = 00:00:11 ; elapsed = 00:00:13 . Memory (MB): peak = 1995.957 ; gain = 422.980
INFO: [Common 17-206] Exiting Vivado at Thu Apr 27 16:11:16 2023...

*** Running vivado
    with args -log digital_safe.vdi -applog -m64 -product Vivado -messageDb vivado.pb -mode batch -source digital_safe.tcl -notrace


****** Vivado v2018.3 (64-bit)
  **** SW Build 2405991 on Thu Dec  6 23:38:27 MST 2018
  **** IP Build 2404404 on Fri Dec  7 01:43:56 MST 2018
    ** Copyright 1986-2018 Xilinx, Inc. All Rights Reserved.

source digital_safe.tcl -notrace
Command: open_checkpoint digital_safe_routed.dcp

Starting open_checkpoint Task

Time (s): cpu = 00:00:00 ; elapsed = 00:00:00.030 . Memory (MB): peak = 259.195 ; gain = 0.000
INFO: [Netlist 29-17] Analyzing 14 Unisim elements for replacement
INFO: [Netlist 29-28] Unisim Transformation completed in 0 CPU seconds
INFO: [Project 1-479] Netlist was created with Vivado 2018.3
INFO: [Device 21-403] Loading part xc7z020clg400-1
INFO: [Project 1-570] Preparing netlist for logic optimization
INFO: [Timing 38-478] Restoring timing data from binary archive.
INFO: [Timing 38-479] Binary timing data restore complete.
INFO: [Project 1-856] Restoring constraints from binary archive.
INFO: [Project 1-853] Binary constraint restore complete.
Reading XDEF placement.
Reading placer database...
Reading XDEF routing.
Read XDEF File: Time (s): cpu = 00:00:01 ; elapsed = 00:00:00.136 . Memory (MB): peak = 1245.258 ; gain = 0.000
Restored from archive | CPU: 1.000000 secs | Memory: 0.000000 MB |
Finished XDEF File Restore: Time (s): cpu = 00:00:01 ; elapsed = 00:00:00.138 . Memory (MB): peak = 1245.258 ; gain = 0.000
Netlist sorting complete. Time (s): cpu = 00:00:00 ; elapsed = 00:00:00 . Memory (MB): peak = 1245.258 ; gain = 0.000
INFO: [Project 1-111] Unisim Transformation Summary:
No Unisim elements were transformed.

INFO: [Project 1-604] Checkpoint was created with Vivado v2018.3 (64-bit) build 2405991
open_checkpoint: Time (s): cpu = 00:00:13 ; elapsed = 00:00:15 . Memory (MB): peak = 1245.258 ; gain = 986.062
Command: write_bitstream -force digital_safe.bit
Attempting to get a license for feature 'Implementation' and/or device 'xc7z020'
INFO: [Common 17-349] Got license for feature 'Implementation' and/or device 'xc7z020'
Running DRC as a precondition to command write_bitstream
INFO: [IP_Flow 19-234] Refreshing IP repositories
INFO: [IP_Flow 19-1704] No user IP repositories specified
INFO: [IP_Flow 19-2313] Loaded Vivado IP repository 'D:/Xilinx/Vivado/2018.3/data/ip'.
INFO: [DRC 23-27] Running DRC with 2 threads
WARNING: [DRC ZPS7-1] PS7 block required: The PS7 cell must be used in this Zynq design in order to enable correct default configuration.
INFO: [Vivado 12-3199] DRC finished with 0 Errors, 1 Warnings
INFO: [Vivado 12-3200] Please refer to the DRC report (report_drc) for more information.
INFO: [Designutils 20-2272] Running write_bitstream with 2 threads.
Loading data files...
Loading site data...
Loading route data...
Processing options...
Creating bitmap...
Creating bitstream...
Writing bitstream ./digital_safe.bit...
INFO: [Vivado 12-1842] Bitgen Completed Successfully.
INFO: [Project 1-120] WebTalk data collection is mandatory when using a WebPACK part without a full Vivado license. To see the specific WebTalk data collected for your design, open the usage_statistics_webtalk.html or usage_statistics_webtalk.xml file in the implementation directory.
Access is denied.
Access is denied.
INFO: [Common 17-83] Releasing license: Implementation
22 Infos, 1 Warnings, 0 Critical Warnings and 0 Errors encountered.
write_bitstream completed successfully
write_bitstream: Time (s): cpu = 00:00:13 ; elapsed = 00:00:13 . Memory (MB): peak = 1742.996 ; gain = 497.738
INFO: [Common 17-206] Exiting Vivado at Thu Apr 27 16:13:26 2023...
